{
  "version": "1",
  "name": "Customer operations review",
  "goal": "Review support messages and payment exceptions. Draft recommended follow-ups. External writes are not granted.",
  "trigger": {
    "kind": "schedule",
    "expression": "rate(30 minutes)"
  },
  "agent": {
    "driver": "codex",
    "capabilities": {
      "profile": "small-business",
      "networkAccess": true,
      "computerUse": "browser"
    }
  },
  "connections": {
    "set": "customer-operations",
    "accounts": [
      {
        "account": "slack-support",
        "access": "read-only"
      },
      {
        "account": "stripe-business",
        "access": "read-only"
      }
    ]
  },
  "deliver": [
    {
      "kind": "slack",
      "route": "C01234567"
    }
  ]
}
